id,offense,secondsLeftInGame,scoreDifferential,yardsToGoal,distanceToFirstDown,isWentForIt,wasSuccess,likelihood,rawRate,smoothedRate,sampleSize,meetsMinSample,blockKey,playText
"323220061013","Georgia",3415,0,5,1,true,true,0.8057,0.8626,0.8057,313,true,"Tied | H1 Early | YTG 1-10 | Dist 1","Alexander Ogletree rush for 4 yards to the GeoSo 1 for a 1ST down."
"302890061022","Georgia",3275,0,16,1,true,true,0.7965,0.8619,0.7965,268,true,"Tied | H1 Early | YTG 11-20 | Dist 1","Aaron Murray rush for 2 yards to the Vandy 14 for a 1ST down."
"401282090104936101","Georgia",398,34,38,1,true,true,0.7823,0.8687,0.7823,198,true,"Ahead 15+ | H2 Mid | YTG 31-40 | Dist 1","Kenny McIntosh run for 15 yds to the Ark 23 for a 1ST down"
"400933857104928501","Georgia",434,28,38,1,true,true,0.7823,0.8687,0.7823,198,true,"Ahead 15+ | H2 Mid | YTG 31-40 | Dist 1","Elijah Holyfield run for 4 yds to the Samf 34 for a 1ST down"
"401012268104949801","Georgia",301,24,38,1,true,true,0.7823,0.8687,0.7823,198,true,"Ahead 15+ | H2 Mid | YTG 31-40 | Dist 1","James Cook run for 1 yd to the SCaro 37 for a 1ST down"
"400548337102915101","Georgia",2328,7,9,1,true,true,0.7822,0.8800,0.7822,175,true,"Ahead 6-8 | H1 Mid | YTG 1-10 | Dist 1","Nick Chubb run for 9 yds for a TD, (Marshall Morgan KICK)"
"400933906101949001","Georgia",3009,0,34,1,true,true,0.7745,0.8126,0.7745,443,true,"Tied | H1 Early | YTG 31-40 | Dist 1","Christian Payne run for 4 yds to the SCaro 30 for a 1ST down"
"272580061135","Georgia",1503,21,4,1,true,true,0.7649,0.8327,0.7649,245,true,"Ahead 15+ | H2 Early | YTG 1-10 | Dist 1","Thomas Brown rush for 4 yards for a TOUCHDOWN."
"273140061188","Georgia",472,18,29,1,true,true,0.7634,0.8458,0.7634,201,true,"Ahead 15+ | H2 Mid | YTG 21-30 | Dist 1","Matthew Stafford pass complete to Tripp Chandler for 26 yards to the Aub 3 for a 1ST down."
"312812633013","Georgia",3349,0,23,1,true,true,0.7575,0.8088,0.7575,319,true,"Tied | H1 Early | YTG 21-30 | Dist 1","Isaiah Crowell rush for 3 yards to the Tenn 20 for a 1ST down."
"2430400610205","Georgia",3567,0,29,1,true,true,0.7575,0.8088,0.7575,319,true,"Tied | H1 Early | YTG 21-30 | Dist 1","Thomas Brown (GA) rushed up the middle for 2 yards."
"401520352102896501","Georgia",2434,17,2,1,true,true,0.7490,0.8833,0.7490,120,true,"Ahead 15+ | H1 Mid | YTG 1-10 | Dist 1","Daijun Edwards run for 2 yds for a TD (Peyton Woodring KICK)"
"401403895104946901","Georgia",330,17,1,1,true,true,0.7489,0.7988,0.7489,323,true,"Ahead 15+ | H2 Mid | YTG 1-10 | Dist 1","Kendall Milton run for 1 yd for a TD, (Jack Podlesny KICK)"
"401628398104879501","Georgia",724,15,1,1,true,true,0.7489,0.7988,0.7489,323,true,"Ahead 15+ | H2 Mid | YTG 1-10 | Dist 1","Trevor Etienne run for 1 yd for a TD (Peyton Woodring KICK)"
"340010061063","Georgia",2625,0,31,1,true,true,0.7445,0.8647,0.7445,133,true,"Tied | H1 Mid | YTG 31-40 | Dist 1","Todd Gurley rush for 1 yard to the Neb 30 for a 1ST down."
"401282090101938301","Georgia",3076,7,35,1,true,true,0.7351,0.8969,0.7351,97,true,"Ahead 6-8 | H1 Early | YTG 31-40 | Dist 1","Zamir White run for 3 yds to the Ark 32 for a 1ST down"
"252670344093","Georgia",2290,11,33,1,true,true,0.7233,0.8977,0.7233,88,true,"Ahead 9-14 | H1 Mid | YTG 31-40 | Dist 1","Brannan Southerland rush for 4 yards to the MiSt 29 for a 1ST down."
"400603907104965401","Georgia",225,24,34,1,true,true,0.7229,0.9221,0.7229,77,true,"Ahead 15+ | H2 Final 4 | YTG 31-40 | Dist 1","Quayvon Hicks run for 4 yds to the Kent 30 for a 1ST down"
"282850061014","Georgia",3278,0,41,1,true,true,0.6896,0.7204,0.6896,465,true,"Tied | H1 Early | YTG 41-50 | Dist 1","Matthew Stafford rush for 3 yards to the Tenn 38 for a 1ST down."
"401520225102906909","Georgia",2370,-4,40,1,true,true,0.6849,0.8283,0.6849,99,true,"Behind 3-5 | H1 Mid | YTG 31-40 | Dist 1","Carson Beck pass complete to Oscar Delp for 7 yds to the SC 33 for a 1ST down"
"401237033102856906","Georgia",2670,-5,36,1,true,true,0.6849,0.8283,0.6849,99,true,"Behind 3-5 | H1 Mid | YTG 31-40 | Dist 1","D'Wan Mathis run for 5 yds to the Ark 31 for a 1ST down"
"400547740104987501","Georgia",84,24,7,1,true,true,0.6837,0.8148,0.6837,108,true,"Ahead 15+ | H2 Final 4 | YTG 1-10 | Dist 1","Nick Chubb run for 4 yds to the Clem 3 for a 1ST down"
"401628386104966601","Georgia",213,17,1,1,true,true,0.6837,0.8148,0.6837,108,true,"Ahead 15+ | H2 Final 4 | YTG 1-10 | Dist 1","Trevor Etienne run for 1 yd for a TD (Peyton Woodring KICK)"
"2324202281408","Georgia",2150,13,45,1,true,true,0.6668,0.7981,0.6668,104,true,"Ahead 9-14 | H1 Mid | YTG 41-50 | Dist 1","Ronnie Powell (GA) rushed up the middle for 2 yards."
"401403895102867801","Georgia",2601,9,50,1,true,true,0.6668,0.7981,0.6668,104,true,"Ahead 9-14 | H1 Mid | YTG 41-50 | Dist 1","Stetson Bennett run for 2 yds to the KntSt 48 for a 1ST down"
"303652116245","Georgia",35,-4,59,5,true,true,0.6624,0.9767,0.6624,43,true,"Behind 3-5 | H2 Final 4 | YTG 51-60 | Dist 3-5","Aaron Murray pass complete to Kris Durham for 30 yards to the UCF 29 for a 1ST down."
"400869013102854301","Georgia",2696,7,28,1,true,true,0.6608,0.8272,0.6608,81,true,"Ahead 6-8 | H1 Mid | YTG 21-30 | Dist 1","Sony Michel run for 3 yds to the Tenn 25 for a 1ST down"
"401769073104969901","Georgia",180,-3,52,9,true,true,0.6590,0.9074,0.6590,54,true,"Behind 3-5 | H2 Final 4 | YTG 51-60 | Dist 9-10","Gunner Stockton pass complete to Zachariah Branch for 16 yds to the MISS 36 for a 1ST down"
"2428300613011","Georgia",30,-5,52,10,true,true,0.6590,0.9074,0.6590,54,true,"Behind 3-5 | H2 Final 4 | YTG 51-60 | Dist 9-10","David Greene (GA) pass across the middle complete to Fred Gibson (GA) for 12 yards."
"253230061048","Georgia",2547,3,10,1,true,true,0.6466,0.7745,0.6466,102,true,"Ahead 3-5 | H1 Mid | YTG 1-10 | Dist 1","DJ Shockley pass complete to Leonard Pope for 10 yards for a TOUCHDOWN."
"262730145104","Georgia",1684,-3,45,1,true,true,0.6460,0.8049,0.6460,82,true,"Behind 3-5 | H2 Early | YTG 41-50 | Dist 1","Kregg Lumpkin rush for 22 yards to the Miss 23 out-of-bounds for a 1ST down."
"2428300612714","Georgia",315,-6,1,1,true,true,0.6403,0.7952,0.6403,83,true,"Behind 6-8 | H2 Mid | YTG 1-10 | Dist 1","Danny Ware (GA) rushed left side for a 1 yard touchdown."
"293250061026","Georgia",3170,-6,46,1,true,true,0.6363,0.7241,0.6363,145,true,"Behind 6-8 | H1 Early | YTG 41-50 | Dist 1","Joe Cox rush for 2 yards to the Kent 44 for a 1ST down."
"322520142089","Georgia",2376,-3,44,1,true,true,0.6219,0.7500,0.6219,96,true,"Behind 3-5 | H1 Mid | YTG 41-50 | Dist 1","Aaron Murray rush for 1 yard to the Misso 43 for a 1ST down."
"2431100961504","Georgia",1965,13,34,1,true,true,0.6193,0.9250,0.6193,40,true,"Ahead 9-14 | H1 Final 4 | YTG 31-40 | Dist 1","Thomas Brown (GA) rushed right side for 24 yards."
"401012295102984201","Georgia",1917,10,32,1,true,true,0.6193,0.9250,0.6193,40,true,"Ahead 9-14 | H1 Final 4 | YTG 31-40 | Dist 1","Brian Herrien run for 6 yds to the Tenn 26 for a 1ST down"
"401012341104985901","Georgia",100,39,26,1,true,true,0.6193,0.8197,0.6193,61,true,"Ahead 15+ | H2 Final 4 | YTG 21-30 | Dist 1","Ian Donald-McIntyre run for 5 yds to the UMass 21 for a 1ST down"
"400548370104985901","Georgia",100,34,29,1,true,true,0.6193,0.8197,0.6193,61,true,"Ahead 15+ | H2 Final 4 | YTG 21-30 | Dist 1","Brendan Douglas run for 6 yds to the Misso 23 for a 1ST down"
"401520225103889908","Georgia",1560,-4,28,1,true,true,0.6169,0.8600,0.6169,50,true,"Behind 3-5 | H2 Early | YTG 21-30 | Dist 1","Carson Beck run for 3 yds to the SC 25 for a 1ST down"
"293110061072","Georgia",2060,31,36,1,true,true,0.6141,0.8462,0.6141,52,true,"Ahead 15+ | H1 Mid | YTG 31-40 | Dist 1","Washaun Ealey rush for 2 yards to the TnTch 34, tackled by Howard Griffin for a 1ST down."
"312600061042","Georgia",2802,20,32,1,true,true,0.6141,0.8462,0.6141,52,true,"Ahead 15+ | H1 Mid | YTG 31-40 | Dist 1","Aaron Murray pass complete to Tavarres King for 32 yards for a TOUCHDOWN."
"2427600611204","Georgia",2452,17,31,1,true,true,0.6141,0.8462,0.6141,52,true,"Ahead 15+ | H1 Mid | YTG 31-40 | Dist 1","Thomas Brown (GA) rushed up the middle for 2 yards."
"400548370104917601","Georgia",503,27,14,1,true,true,0.6103,0.6651,0.6103,218,true,"Ahead 15+ | H2 Mid | YTG 11-20 | Dist 1","Nick Chubb run for 5 yds to the Misso 9 for a 1ST down"
"2324202282807","Georgia",190,29,29,2,true,true,0.5908,0.8750,0.5908,40,true,"Ahead 15+ | H2 Final 4 | YTG 21-30 | Dist 2","D.J. Shockley (GA) rushed up the middle for a 29 yard touchdown."
"272440061194","Georgia",235,21,28,2,true,true,0.5908,0.8750,0.5908,40,true,"Ahead 15+ | H2 Final 4 | YTG 21-30 | Dist 2","Knowshon Moreno rush for 3 yards to the OKSt 25 for a 1ST down."
"340010061232","Georgia",102,-5,24,1,true,true,0.5863,0.9375,0.5863,32,true,"Behind 3-5 | H2 Final 4 | YTG 21-30 | Dist 1","Hutson Mason rush for 1 yard to the Neb 23 for a 1ST down."
"313090061321","Georgia",661,46,44,1,true,true,0.5845,0.6425,0.5845,193,true,"Ahead 15+ | H2 Mid | YTG 41-50 | Dist 1","Hutson Mason rush for 1 yard to the NMxSt 43 for a 1ST down."
"400933885104854501","Georgia",894,31,41,1,true,true,0.5845,0.6425,0.5845,193,true,"Ahead 15+ | H2 Mid | YTG 41-50 | Dist 1","Jake Fromm run for 19 yds to the Vandy 22 for a 1ST down"
"401237117103886101","Georgia",1598,11,22,1,true,true,0.5820,0.7143,0.5820,84,true,"Ahead 9-14 | H2 Early | YTG 21-30 | Dist 1","Zamir White run for 22 yds for a TD (Jack Podlesny KICK)"
"401237033102899207","Georgia",2407,-5,39,2,true,true,0.5788,0.7719,0.5788,57,true,"Behind 3-5 | H1 Mid | YTG 31-40 | Dist 2","Stetson Bennett run for 6 yds to the Ark 33 for a 1ST down"
"401403944102859801","Georgia",2641,7,16,1,true,true,0.5778,0.7324,0.5778,71,true,"Ahead 6-8 | H1 Mid | YTG 11-20 | Dist 1","Stetson Bennett run for 1 yd to the MisSt 15 for a 1ST down"
"401752669101904401","Georgia",3295,0,31,2,true,true,0.5771,0.6154,0.5771,286,true,"Tied | H1 Early | YTG 31-40 | Dist 2","Gunner Stockton run for 14 yds to the MRSH 17 for a 1ST down"
"401752731103968901","Georgia",1090,0,37,1,true,true,0.5630,0.7872,0.5630,47,true,"Tied | H2 Early | YTG 31-40 | Dist 1","Nate Frazier run for 5 yds to the AUB 32 for a 1ST down"
"262590061102","Georgia",1655,10,42,1,true,true,0.5541,0.6509,0.5541,106,true,"Ahead 9-14 | H2 Early | YTG 41-50 | Dist 1","Brannan Southerland rush for 1 yard to the UAB 41 for a 1ST down."
"401628414101896701","Georgia",3332,7,2,2,true,true,0.5476,0.7451,0.5476,51,true,"Ahead 6-8 | H1 Early | YTG 1-10 | Dist 2","Nate Frazier 2 Yd Run (Peyton Woodring Kick)"
"401110788103875901","Georgia",1660,34,40,2,true,true,0.5279,0.6333,0.5279,90,true,"Ahead 15+ | H2 Early | YTG 31-40 | Dist 2","Jake Fromm run for 3 yds to the ArkSt 37 for a 1ST down"
"2429000612108","Georgia",1254,26,38,2,true,true,0.5279,0.6333,0.5279,90,true,"Ahead 15+ | H2 Early | YTG 31-40 | Dist 2","David Greene (GA) pass left side complete to Reggie Brown (GA) for a 38 yard touchdown."
"263150002189","Georgia",215,22,12,2,true,true,0.5127,0.7568,0.5127,37,true,"Ahead 15+ | H2 Final 4 | YTG 11-20 | Dist 2","Brannan Southerland rush for 3 yards to the Aub 9 for a 1ST down."
"332920238128","Georgia",1827,9,2,1,true,true,0.5090,0.6462,0.5090,65,true,"Ahead 9-14 | H1 Final 4 | YTG 1-10 | Dist 1","Aaron Murray rush for 2 yards for a TOUCHDOWN."
"252670344064","Georgia",3190,4,33,1,true,true,0.5055,0.7647,0.5055,34,true,"Ahead 3-5 | H1 Early | YTG 31-40 | Dist 1","Brannan Southerland rush for 4 yards to the MiSt 29 for a 1ST down."
"263640259154","Georgia",450,10,1,1,true,true,0.5022,0.5703,0.5022,128,true,"Ahead 9-14 | H2 Mid | YTG 1-10 | Dist 1","Brannan Southerland rush for 1 yard for a TOUCHDOWN."
"2430400610607","Georgia",3125,0,55,1,true,true,0.4952,0.5116,0.4952,516,true,"Tied | H1 Early | YTG 51-60 | Dist 1","Thomas Brown (GA) rushed right side for 20 yards."
"312812633007","Georgia",3538,0,60,1,true,true,0.4952,0.5116,0.4952,516,true,"Tied | H1 Early | YTG 51-60 | Dist 1","Isaiah Crowell rush for 11 yards to the Tenn 49 for a 1ST down."
"332782633075","Georgia",2210,7,39,4,true,true,0.4805,0.5246,0.4805,183,true,"Ahead 6-8 | H1 Mid | YTG 31-40 | Dist 3-5","Aaron Murray pass complete to Chris Conley for 24 yards to the Tenn 15 for a 1ST down."
"272720061284","Georgia",101,28,16,4,true,true,0.4698,0.5323,0.4698,124,true,"Ahead 15+ | H2 Final 4 | YTG 11-20 | Dist 3-5","Kalvin Daniels rush for 9 yards to the Miss 7 for a 1ST down."
"303652116237","Georgia",95,-4,78,8,true,true,0.4599,0.6667,0.4599,36,true,"Behind 3-5 | H2 Final 4 | YTG 71-80 | Dist 6-8","Aaron Murray pass complete to A.J. Green for 14 yards to the Geo 36 for a 1ST down."
"332430228046","Georgia",3105,-7,33,4,true,true,0.4445,0.4733,0.4445,243,true,"Behind 6-8 | H1 Early | YTG 31-40 | Dist 3-5","Aaron Murray pass complete to Justin Scott-Wesley for 11 yards to the Clem 22 for a 1ST down."
"400933831103976601","Georgia",1053,24,37,4,true,true,0.4429,0.4713,0.4429,244,true,"Ahead 15+ | H2 Early | YTG 31-40 | Dist 3-5","Jake Fromm pass complete to Javon Wims for 22 yds to the AppSt 15 for a 1ST down"
"332500061215","Georgia",146,11,32,2,true,true,0.4392,0.6667,0.4392,30,true,"Ahead 9-14 | H2 Final 4 | YTG 31-40 | Dist 2","Todd Gurley rush for 5 yards to the SCaro 27 for a 1ST down."
"400603931101987003","Georgia",2789,-7,36,4,true,true,0.4388,0.4726,0.4388,201,true,"Behind 6-8 | H1 Mid | YTG 31-40 | Dist 3-5","Greyson Lambert pass complete to Malcolm Mitchell for 5 yds to the Aub 31 for a 1ST down"
"401628339103887906","Georgia",1580,38,60,1,true,true,0.4385,0.4889,0.4385,135,true,"Ahead 15+ | H2 Early | YTG 51-60 | Dist 1","Gunner Stockton run for 1 yd to the UGA 41 for a 1ST down"
"401752669103964801","Georgia",1131,38,2,2,true,true,0.4378,0.4957,0.4378,117,true,"Ahead 15+ | H2 Early | YTG 1-10 | Dist 2","Gunner Stockton pass complete to London Humphreys for 2 yds for a TD (Peyton Woodring KICK)"
"273070061113","Georgia",2328,0,54,1,true,true,0.4369,0.4957,0.4369,115,true,"Tied | H1 Mid | YTG 51-60 | Dist 1","Knowshon Moreno rush for 4 yards to the 50 yard line for a 1ST down."
"272580061044","Georgia",2780,0,56,1,true,true,0.4369,0.4957,0.4369,115,true,"Tied | H1 Mid | YTG 51-60 | Dist 1","Brannan Southerland rush for 2 yards to the Geo 46 for a 1ST down."
"401012334102997801","Georgia",1821,10,38,3,true,true,0.4245,0.5345,0.4245,58,true,"Ahead 9-14 | H1 Final 4 | YTG 31-40 | Dist 3-5","Terry Godwin 38 Yd pass from Jake Fromm (Rodrigo Blankenship Kick)"
"401282136101946601","Georgia",3033,14,32,5,true,true,0.4180,0.5556,0.4180,45,true,"Ahead 9-14 | H1 Early | YTG 31-40 | Dist 3-5","Stetson Bennett pass complete to Kenny McIntosh for 32 yds for a TD, (Jack Podlesny KICK)"
"2426200610509","Georgia",3091,-3,17,1,true,true,0.4134,0.5610,0.4134,41,true,"Behind 3-5 | H1 Early | YTG 11-20 | Dist 1","Michael Cooper (GA) rushed up the middle for 2 yards."
"400548385104888401","Georgia",675,52,15,2,true,true,0.4113,0.4673,0.4113,107,true,"Ahead 15+ | H2 Mid | YTG 11-20 | Dist 2","Brendan Douglas run for 8 yds to the Troy 7 for a 1ST down"
"401628381103934401","Georgia",1315,4,55,1,true,true,0.4105,0.5082,0.4105,61,true,"Ahead 3-5 | H2 Early | YTG 51-60 | Dist 1","Carson Beck run for 1 yd to the UGA 46 for a 1ST down"
"401442010104899101","Georgia",608,45,24,5,true,true,0.4093,0.4251,0.4093,374,true,"Ahead 15+ | H2 Mid | YTG 21-30 | Dist 3-5","Carson Beck pass complete to Dillon Bell for 11 yds to the TCU 13 for a 1ST down"
"2324900611908","Georgia",955,17,26,4,true,true,0.4093,0.4251,0.4093,374,true,"Ahead 15+ | H2 Mid | YTG 21-30 | Dist 3-5","Michael Cooper (GA) rushed right side for 8 yards."
"312812633056","Georgia",2755,3,57,1,true,true,0.4012,0.4592,0.4012,98,true,"Ahead 3-5 | H1 Mid | YTG 51-60 | Dist 1","Aaron Murray rush for 2 yards to the Geo 45 for a 1ST down."
"252670344150","Georgia",1456,14,35,5,true,true,0.3965,0.4323,0.3965,155,true,"Ahead 9-14 | H2 Early | YTG 31-40 | Dist 3-5","DJ Shockley pass complete to Leonard Pope for 34 yards to the MiSt 1 for a 1ST down."
"401256108103914401","Georgia",1435,11,38,5,true,true,0.3965,0.4323,0.3965,155,true,"Ahead 9-14 | H2 Early | YTG 31-40 | Dist 3-5","JT Daniels pass complete to George Pickens for 20 yds to the Cincy 18 for a 1ST down"
"401752731104949901","Georgia",300,3,40,3,true,true,0.3952,0.4476,0.3952,105,true,"Ahead 3-5 | H2 Mid | YTG 31-40 | Dist 3-5","Gunner Stockton pass complete to London Humphreys for 8 yds to the AUB 32 for a 1ST down"
"401403911104988201","Georgia",77,32,57,1,true,true,0.3655,0.4375,0.3655,64,true,"Ahead 15+ | H2 Final 4 | YTG 51-60 | Dist 1","Branson Robinson run for 30 yds to the Aub 27 for a 1ST down"
"401520327102949301","Georgia",2106,7,17,2,true,true,0.3593,0.4857,0.3593,35,true,"Ahead 6-8 | H1 Mid | YTG 11-20 | Dist 2","Kendall Milton run for 2 yds to the VAN 15 for a 1ST down"
"400603904103934001","Georgia",1319,0,65,1,true,true,0.3545,0.4074,0.3545,81,true,"Tied | H2 Early | YTG 61-70 | Dist 1","Sony Michel run for 2 yds to the Geo 37 for a 1ST down"
"401403928104878001","Georgia",739,15,33,7,true,true,0.3489,0.3630,0.3489,292,true,"Ahead 15+ | H2 Mid | YTG 31-40 | Dist 6-8","Stetson Bennett pass complete to Brock Bowers for 29 yds to the Fla 4 for a 1ST down"
"333200002229","Georgia",109,0,5,5,true,true,0.3426,0.4318,0.3426,44,true,"Tied | H2 Final 4 | YTG 1-10 | Dist 3-5","Aaron Murray rush for 5 yards for a TOUCHDOWN."
"293110061137","Georgia",742,38,46,2,true,true,0.3402,0.3729,0.3402,118,true,"Ahead 15+ | H2 Mid | YTG 41-50 | Dist 2","Carlton Thomas rush for 2 yards to the TnTch 44, tackled by LaDarrius Verge and Jake McIntosh for a 1ST down."
"312670145166","Georgia",813,11,56,1,true,true,0.3278,0.3678,0.3278,87,true,"Ahead 9-14 | H2 Mid | YTG 51-60 | Dist 1","Richard Samuel rush for 1 yard to the Geo 45, tackled by Serderius Bryant and Joel Kight for a 1ST down."
"332430228166","Georgia",1440,-7,66,1,true,true,0.3256,0.3608,0.3256,97,true,"Behind 6-8 | H2 Early | YTG 61-70 | Dist 1","Collin Barber rush for 5 yards to the Geo 39 for a 1ST down."
"293250061253","Georgia",315,-7,29,8,true,true,0.3252,0.3626,0.3252,91,true,"Behind 6-8 | H2 Mid | YTG 21-30 | Dist 6-8","Joe Cox pass complete to Caleb King for 13 yards to the Kent 16 for a 1ST down."
"401403928102958301","Georgia",2056,18,66,1,true,true,0.3199,0.3953,0.3199,43,true,"Ahead 15+ | H1 Mid | YTG 61-70 | Dist 1","Stetson Bennett run for 2 yds to the Geo 36 for a 1ST down"
"302890061226","Georgia",895,43,51,1,true,true,0.3160,0.3333,0.3160,180,true,"Ahead 15+ | H2 Mid | YTG 51-60 | Dist 1","Hutson Mason rush for 1 yard to the 50 yard line for a 1ST down."
"401628386102859305","Georgia",2646,7,21,4,true,true,0.3115,0.3361,0.3115,122,true,"Ahead 6-8 | H1 Mid | YTG 21-30 | Dist 3-5","Carson Beck pass complete to Oscar Delp for 11 yds to the MSST 10 for a 1ST down"
"401752766503","Georgia",1129,4,64,1,true,true,0.3066,0.3478,0.3066,69,true,"Ahead 3-5 | H2 Early | YTG 61-70 | Dist 1","#14 G.Stockton pass complete short right to #33 C.Bowens caught at UGA36, for 10 yards to the UGA46 (#18 L.Lefau), 1ST DOWN"
"2328426332005","Georgia",1667,13,55,1,true,true,0.2775,0.3012,0.2775,83,true,"Ahead 9-14 | H2 Early | YTG 51-60 | Dist 1","David Greene (GA) rushed up the middle for 1 yard."
"401628381104946901","Georgia",330,15,66,1,true,true,0.2752,0.2876,0.2752,153,true,"Ahead 15+ | H2 Mid | YTG 61-70 | Dist 1","Trevor Etienne run for 1 yd to the UGA 35 for a 1ST down"
"400603925103949004","Georgia",1209,-7,80,1,true,true,0.2678,0.3043,0.2678,46,true,"Behind 6-8 | H2 Early | YTG 71-80 | Dist 1","Sony Michel run for 3 yds to the GeoSo 17 for a 1ST down"
"292900238186","Georgia",705,17,15,5,true,true,0.2631,0.2676,0.2631,340,true,"Ahead 15+ | H2 Mid | YTG 11-20 | Dist 3-5","Carlton Thomas rush for 6 yards to the Vandy 9, tackled by Sean Richardson for a 1ST down."
"302610061113","Georgia",2098,-7,71,1,true,true,0.2464,0.2593,0.2464,81,true,"Behind 6-8 | H1 Mid | YTG 71-80 | Dist 1","Aaron Murray rush for 1 yard to the Geo 30 for a 1ST down."
"401520300104976101","Georgia",158,38,7,7,true,true,0.2342,0.2432,0.2342,74,true,"Ahead 15+ | H2 Final 4 | YTG 1-10 | Dist 6-8","Brock Vandagriff pass complete to Andrew Paul for 7 yds for a TD (Peyton Woodring KICK)"
"401135289103927901","Georgia",1340,12,19,2,true,true,0.2292,0.2432,0.2292,37,true,"Ahead 9-14 | H2 Early | YTG 11-20 | Dist 2","Jake Camarda run for 6 yds to the Bayl 13 for a 1ST down"
"401110826104904101","Georgia",598,14,29,4,true,true,0.2218,0.2235,0.2218,170,true,"Ahead 9-14 | H2 Mid | YTG 21-30 | Dist 3-5","Jake Fromm pass complete to George Pickens for 7 yds to the Kent 22 for a 1ST down"
"400548381101899401","Georgia",3305,-3,71,1,true,true,0.2169,0.2200,0.2169,50,true,"Behind 3-5 | H1 Early | YTG 71-80 | Dist 1","Hutson Mason run for 3 yds to the Geo 32 for a 1ST down"
"401282122101995701","Georgia",2742,4,35,6,true,true,0.2167,0.2177,0.2167,147,true,"Ahead 3-5 | H1 Mid | YTG 31-40 | Dist 6-8","Arian Smith 35 Yd pass from Stetson Bennett (Jack Podlesny Kick)"
"262450061083","Georgia",2228,30,98,1,true,true,0.2118,1.0000,0.3244,5,false,"Ahead 15+ | H1 Mid | YTG 91-100 | Dist 1","Thomas Brown rush for 2 yards for a TOUCHDOWN."
"401752669101977801","Georgia",2841,14,13,1,true,true,0.2118,0.5263,0.3337,19,false,"Ahead 9-14 | H1 Early | YTG 11-20 | Dist 1","Gunner Stockton run for 13 yds for a TD (Peyton Woodring KICK)"
"283200002138","Georgia",1120,1,40,1,true,true,0.2118,0.8333,0.4449,18,false,"Ahead 0-2 | H2 Early | YTG 31-40 | Dist 1","Matthew Stafford rush for 2 yards to the Aub 38 for a 1ST down."
"400868998104987001","Georgia",89,1,20,10,true,true,0.2118,0.3000,0.2338,10,false,"Ahead 0-2 | H2 Final 4 | YTG 11-20 | Dist 9-10","Isaiah McKenzie 20 Yd pass from Jacob Eason (William Ham Kick)"
"292760061139","Georgia",855,0,99,1,true,true,0.2118,0.8750,0.3514,8,false,"Tied | H2 Mid | YTG 91-100 | Dist 1","Joe Cox pass complete to Shaun Chapas for 1 yard for a TOUCHDOWN."
"332710061192","Georgia",560,0,38,2,true,true,0.2118,0.7500,0.3990,16,false,"Tied | H2 Mid | YTG 31-40 | Dist 2","Aaron Murray pass complete to Justin Scott-Wesley for 10 yards to the LSU 14, LSU penalty 14 yard Roughing Passer on Jermauria Rasco accepted for a 1ST down."
"401752705104976701","Georgia",152,0,28,6,true,true,0.2118,0.1304,0.1765,23,false,"Tied | H2 Final 4 | YTG 21-30 | Dist 6-8","Gunner Stockton pass complete to London Humphreys for 28 yds for a TD (Gunner Stockton pass to Zachariah Branch for Two-Point Conversion)"
"302610061027","Georgia",3169,-1,1,1,true,true,0.2118,0.8824,0.4543,17,false,"Behind 0-2 | H1 Early | YTG 1-10 | Dist 1","Aaron Murray rush for 1 yard for a TOUCHDOWN."
"303170002025","Georgia",3201,-1,31,2,true,true,0.2118,0.7500,0.2751,4,false,"Behind 0-2 | H1 Early | YTG 31-40 | Dist 2","Aaron Murray pass complete to A.J. Green for 31 yards for a TOUCHDOWN."
"400869026104974406","Georgia",175,-1,73,13,true,true,0.2118,1.0000,0.3609,7,false,"Behind 0-2 | H2 Final 4 | YTG 71-80 | Dist 11-14","Jacob Eason pass complete to Terry Godwin for 23 yds to the 50 yard line for a 1ST down"
"400876103103914401","Georgia",1435,-2,21,6,true,true,0.2118,0.0741,0.1465,27,false,"Behind 0-2 | H2 Early | YTG 21-30 | Dist 6-8","Brice Ramsey run for 11 yds to the TCU 10 for a 1ST down"
"292620008111","Georgia",1942,-4,31,2,true,true,0.2118,0.6522,0.4029,23,false,"Behind 3-5 | H1 Final 4 | YTG 31-40 | Dist 2","Joe Cox pass complete to Michael Moore for 6 yards to the Ark 25 for a 1ST down."
"401628374104988401","Georgia",75,-7,47,2,true,true,0.2118,1.0000,0.5363,21,false,"Behind 6-8 | H2 Final 4 | YTG 41-50 | Dist 2","Carson Beck pass complete to Colbie Young for 11 yds to the ALA 36 for a 1ST down"
"2400125090406","Georgia",3120,7,52,2,true,true,0.2066,0.2037,0.2066,54,true,"Ahead 6-8 | H1 Early | YTG 51-60 | Dist 2","Sean Jones (GA) rushed right side for 4 yards."
"2431100963211","Georgia",458,24,27,9,true,true,0.1932,0.1895,0.1932,153,true,"Ahead 15+ | H2 Mid | YTG 21-30 | Dist 9-10","D.J. Shockley (GA) rushed left side for 22 yards."
"262450061063","Georgia",2662,17,80,1,true,true,0.1872,0.1667,0.1872,36,true,"Ahead 15+ | H1 Mid | YTG 71-80 | Dist 1","Brannan Southerland rush for 3 yards to the WKty 17 for a 1ST down."
"401403918103966401","Georgia",1115,31,32,10,true,true,0.1869,0.1802,0.1869,111,true,"Ahead 15+ | H2 Early | YTG 31-40 | Dist 9-10","Stetson Bennett pass complete to Kearis Jackson for 14 yds to the Vandy 18 for a 1ST down"
"401520364101854210","Georgia",3597,0,47,5,true,true,0.1721,0.1708,0.1721,890,true,"Tied | H1 Early | YTG 41-50 | Dist 3-5","Carson Beck pass complete to Rara Thomas for 26 yds to the MIZ 21 for a 1ST down"
"332500061034","Georgia",2982,4,31,13,true,true,0.1367,0.1067,0.1367,75,true,"Ahead 3-5 | H1 Early | YTG 31-40 | Dist 11-14","Aaron Murray pass complete to Justin Scott-Wesley for 24 yards to the SCaro 7 for a 1ST down."
"401769073103966101","Georgia",1118,2,70,5,true,true,0.1247,0.0667,0.1247,45,true,"Ahead 0-2 | H2 Early | YTG 61-70 | Dist 3-5","Landon Roldan pass complete to Lawson Luckie for 16 yds to the UGA 46 for a 1ST down"
"401282122103917301","Georgia",1406,30,19,3,true,true,0.1165,0.1036,0.1165,222,true,"Ahead 15+ | H2 Early | YTG 11-20 | Dist 3-5","JT Daniels pass complete to John FitzPatrick for 7 yds to the Misso 12 for a 1ST down"
"253230061065","Georgia",2265,4,41,6,true,true,0.1009,0.0775,0.1009,142,true,"Ahead 3-5 | H1 Mid | YTG 41-50 | Dist 6-8","DJ Shockley pass complete to Mohamed Massaquoi for 13 yards to the Kent 28 for a 1ST down."
"253230061042","Georgia",2608,-3,54,4,true,true,0.0861,0.0688,0.0861,218,true,"Behind 3-5 | H1 Mid | YTG 51-60 | Dist 3-5","Jeff Owens rush for 35 yards to the Kent 19 for a 1ST down."